{
  "metadata": {
    "gameId": "pulpulak",
    "version": "1.0.0",
    "description": "Complete walkthrough scenarios for Pulpulak cooperative game",
    "createdAt": "2025-01-06T00:00:00Z",
    "estimatedPlayTime": "30-45 minutes"
  },
  "walkthroughs": [
    {
      "id": "princess_completes_both_quests",
      "name": "Княжна выполняет оба квеста",
      "description": "Сценарий где княжна использует смену одежды чтобы выполнить квесты обоих персонажей",
      "difficulty": "medium",
      "steps": [
        {
          "stepNumber": 1,
          "description": "Начальная сцена пробуждения - княжна готовится к дню",
          "character": "princess",
          "action": {
            "type": "scene_choice",
            "target": "coop_awakening",
            "choice": "prepare_morning"
          },
          "preconditions": [
            {
              "type": "location",
              "character": "princess",
              "value": "princess_chamber",
              "operator": "equals"
            }
          ],
          "expectedResult": {
            "gameStateChanges": [
              {
                "character": "princess",
                "property": "location",
                "newValue": "princess_chamber"
              }
            ],
            "questProgression": [],
            "dialogueUnlocks": [],
            "locationAccess": []
          }
        },
        {
          "stepNumber": 2,
          "description": "Княжна идет в тронный зал к советнику",
          "character": "princess",
          "action": {
            "type": "move",
            "target": "throne_room"
          },
          "preconditions": [],
          "expectedResult": {
            "gameStateChanges": [
              {
                "character": "princess",
                "property": "location",
                "newValue": "throne_room"
              }
            ],
            "questProgression": [],
            "dialogueUnlocks": [],
            "locationAccess": []
          }
        },
        {
          "stepNumber": 3,
          "description": "Княжна получает квест от советника о пропавшей реликвии",
          "character": "princess",
          "action": {
            "type": "dialogue",
            "target": "royal_advisor",
            "choice": "ask_about_relic"
          },
          "preconditions": [
            {
              "type": "outfit",
              "character": "princess",
              "value": "princess_dress",
              "operator": "equals"
            }
          ],
          "expectedResult": {
            "gameStateChanges": [
              {
                "character": "princess",
                "property": "quest",
                "newValue": "princess_lost_relic"
              }
            ],
            "questProgression": [
              {
                "questId": "princess_lost_relic",
                "stepCompleted": "get_quest",
                "newStatus": "active"
              }
            ],
            "dialogueUnlocks": ["relic_quest_given"],
            "locationAccess": []
          }
        },
        {
          "stepNumber": 4,
          "description": "Княжна идет в библиотеку к библиотекарю",
          "character": "princess",
          "action": {
            "type": "move",
            "target": "library"
          },
          "preconditions": [],
          "expectedResult": {
            "gameStateChanges": [
              {
                "character": "princess",
                "property": "location",
                "newValue": "library"
              }
            ],
            "questProgression": [],
            "dialogueUnlocks": [],
            "locationAccess": []
          }
        },
        {
          "stepNumber": 5,
          "description": "Княжна говорит с библиотекарем о древних реликвиях",
          "character": "princess",
          "action": {
            "type": "dialogue",
            "target": "librarian",
            "choice": "start_quest"
          },
          "preconditions": [],
          "expectedResult": {
            "gameStateChanges": [
              {
                "character": "princess",
                "property": "dialogue_memory",
                "newValue": "librarian_consulted"
              }
            ],
            "questProgression": [
              {
                "questId": "princess_lost_relic",
                "stepCompleted": "search_library",
                "newStatus": "progressing"
              }
            ],
            "dialogueUnlocks": ["librarian_consulted"],
            "locationAccess": ["secret_archive"]
          }
        },
        {
          "stepNumber": 6,
          "description": "Княжна идет в секретный архив",
          "character": "princess",
          "action": {
            "type": "move",
            "target": "secret_archive"
          },
          "preconditions": [],
          "expectedResult": {
            "gameStateChanges": [
              {
                "character": "princess",
                "property": "location",
                "newValue": "secret_archive"
              }
            ],
            "questProgression": [],
            "dialogueUnlocks": [],
            "locationAccess": []
          }
        },
        {
          "stepNumber": 7,
          "description": "Княжна получает информацию из архива",
          "character": "princess",
          "action": {
            "type": "dialogue",
            "target": "librarian",
            "choice": "start_quest"
          },
          "preconditions": [],
          "expectedResult": {
            "gameStateChanges": [
              {
                "character": "princess",
                "property": "dialogue_memory",
                "newValue": "archive_consulted"
              }
            ],
            "questProgression": [
              {
                "questId": "princess_lost_relic",
                "stepCompleted": "talk_to_librarian",
                "newStatus": "ready_to_complete"
              }
            ],
            "dialogueUnlocks": ["archive_consulted"],
            "locationAccess": []
          }
        },
        {
          "stepNumber": 8,
          "description": "Княжна возвращается к советнику с информацией",
          "character": "princess",
          "action": {
            "type": "move",
            "target": "throne_room"
          },
          "preconditions": [],
          "expectedResult": {
            "gameStateChanges": [
              {
                "character": "princess",
                "property": "location",
                "newValue": "throne_room"
              }
            ],
            "questProgression": [],
            "dialogueUnlocks": [],
            "locationAccess": []
          }
        },
        {
          "stepNumber": 9,
          "description": "Княжна завершает квест реликвии",
          "character": "princess",
          "action": {
            "type": "dialogue",
            "target": "royal_advisor",
            "choice": "report_relic_findings"
          },
          "preconditions": [
            {
              "type": "dialogue_memory",
              "character": "princess",
              "value": "has_archive_info",
              "operator": "equals"
            }
          ],
          "expectedResult": {
            "gameStateChanges": [
              {
                "character": "princess",
                "property": "quest",
                "newValue": "completed"
              }
            ],
            "questProgression": [
              {
                "questId": "princess_lost_relic",
                "stepCompleted": "return_to_advisor",
                "newStatus": "completed"
              }
            ],
            "dialogueUnlocks": ["quest_completed"],
            "locationAccess": []
          }
        },
        {
          "stepNumber": 10,
          "description": "Княжна возвращается в спальню для смены одежды",
          "character": "princess",
          "action": {
            "type": "move",
            "target": "princess_chamber"
          },
          "preconditions": [],
          "expectedResult": {
            "gameStateChanges": [
              {
                "character": "princess",
                "property": "location",
                "newValue": "princess_chamber"
              }
            ],
            "questProgression": [],
            "dialogueUnlocks": [],
            "locationAccess": []
          }
        },
        {
          "stepNumber": 11,
          "description": "Княжна меняется одеждой с помощницей",
          "character": "princess",
          "action": {
            "type": "outfit_swap",
            "target": "helper"
          },
          "preconditions": [
            {
              "type": "location",
              "character": "helper",
              "value": "princess_chamber",
              "operator": "equals"
            }
          ],
          "expectedResult": {
            "gameStateChanges": [
              {
                "character": "princess",
                "property": "outfit",
                "newValue": "helper_dress"
              },
              {
                "character": "helper",
                "property": "outfit",
                "newValue": "princess_dress"
              }
            ],
            "questProgression": [],
            "dialogueUnlocks": [],
            "locationAccess": []
          }
        },
        {
          "stepNumber": 12,
          "description": "Княжна в простой одежде идет к повару",
          "character": "princess",
          "action": {
            "type": "move",
            "target": "kitchen"
          },
          "preconditions": [
            {
              "type": "outfit",
              "character": "princess",
              "value": "helper_dress",
              "operator": "equals"
            }
          ],
          "expectedResult": {